id,created_at,text,media_url
895150148153561088,2017-08-09 05:10:01,"b'Aadhaar security is a big concern, admits Nandan Nilekani https://t.co/XbgRcVXXDU via @TOIBengaluru https://t.co/emnvoFO2av'",http://pbs.twimg.com/media/DGwyjwCUAAAhT1B.jpg
895147634926682112,2017-08-09 05:00:01,b'Congress targets BJP in cheeky Twitter quiz on Quit India anniversary https://t.co/Zeww4Oc4Yt https://t.co/fsLFvodRbG',http://pbs.twimg.com/media/DGwxWC5UMAAmnOW.jpg
895145114879877121,2017-08-09 04:50:01,"b'Woman foils rape bid, thrown off 2nd floor https://t.co/xKkovXeN6w via @TOIDelhi https://t.co/j7OzOMXpB9'",http://pbs.twimg.com/media/DGwwHHdXgAAdCsv.jpg
895144535898050560,2017-08-09 04:47:42,b'Take a look at all the top news stories in 60 seconds https://t.co/kE2KMPg06N',http://pbs.twimg.com/media/DGwxJ6jWsAEbvGp.jpg
895142649627160577,2017-08-09 04:40:13,"b'Vikas Barala, accused of stalking Chandigarh woman, summoned by police https://t.co/IFsIiaVuL2 https://t.co/rQy7hNEP9J'",http://pbs.twimg.com/media/DGwuIkAUAAEmVD-.jpg
895142475660120065,2017-08-09 04:39:31,"b""RT @TOIMumbai: #MarathaKrantiMorcha community in Navi Mumbai going towards Mumbai's Azad Maidan https://t.co/UQNqpOPxgI""",http://pbs.twimg.com/media/DGwtzCBU0AAWf6F.jpg
895140083149316096,2017-08-09 04:30:01,"b""Congress, BJP set for clash on 'Quit India' resolution today https://t.co/IQjNu19JrK https://t.co/P5YIm0WK9j""",http://pbs.twimg.com/media/DGwq8WzVYAAmzkj.jpg
895135355464175617,2017-08-09 04:11:14,"b'The stress is killing Army: Suicides, fragging claim over 100 a year https://t.co/cOzlPwTOGT https://t.co/l4m7SDWpyl'",http://pbs.twimg.com/media/DGwn8oUUQAAxzQu.jpg
895132531833655296,2017-08-09 04:00:01,b'EC declares votes of 2 Congress MLAs who had cross-voted invalid https://t.co/7vWMlgaRBQ https://t.co/MDAginZ05y',http://pbs.twimg.com/media/DGwbHduVoAAQhiH.jpg
895129100121063424,2017-08-09 03:46:22,b'RT @TOIMumbai: Roads to avoid in Mumbai today. Please tweet your pics to @TOIMumbai https://t.co/78tG0aafN3',http://pbs.twimg.com/media/DGwiaEZVwAE1wn6.jpg
895127749689434113,2017-08-09 03:41:00,b'RT @TOIMumbai: Mumbai: Traffic movement affected at various places due to Maratha Kranti Morcha rally. https://t.co/jXpF5QuXDp',http://pbs.twimg.com/media/DGweMe1UAAAtC8K.jpg
895122832643969024,2017-08-09 03:21:28,b'Watch the video that put rebel Cong MLAs in trouble #RajyaSabhaPolls https://t.co/PL4KH1GYUF',http://pbs.twimg.com/media/DGwdZaFVYAI_ZOg.jpg
895115794266312704,2017-08-09 02:53:30,"b""In 2016, Rahul Gandhi's office had complained to SPG against armoured cars https://t.co/HlfTcBTIgd https://t.co/h3lonuSRsK""",http://pbs.twimg.com/media/DGwXBi-U0AAcd43.jpg
895110982938222592,2017-08-09 02:34:23,b'Master strategist @ahmedpatel gets one over @AmitShah https://t.co/0GgzmiUQNc https://t.co/7kUbMAIebt',http://pbs.twimg.com/media/DGwSrZrV0AAobeG.jpg
895108087337566208,2017-08-09 02:22:52,b'BJP MP from Ajmer and former Union minister Sanwar Lal Jat passes away in Delhi https://t.co/s9GrRMkHkk',http://pbs.twimg.com/media/DGwP8L3XcAA_6VS.jpg
895105225031262209,2017-08-09 02:11:30,"b'In Gujarat RS seat cliffhanger, Sonia\xe2\x80\x99s top adviser snatches victory off last ball https://t.co/DGu1ys0lhA https://t.co/IuqrKx7fuK'",http://pbs.twimg.com/media/DGwNX6qUQAQYsB7.jpg
895094439357562880,2017-08-09 01:28:39,"b""Nepal won't take any sides in India-China standoff: Deputy PM https://t.co/FQijXhnbqa https://t.co/hIMBPAX84s""",http://pbs.twimg.com/media/DGwDoYBVYAA8KiX.jpg
895086637838852097,2017-08-09 00:57:39,"b""North Korea says considering strike on Guam after @realDonaldTrump warns of 'fire and fury' https://t.co/EATRSPO55u https://t.co/d7Mz56zWcv""",http://pbs.twimg.com/media/DGv8iVHUAAET5sO.jpg
895068386807369729,2017-08-08 23:45:07,b'Bhutan acknowledges that Doklam is a Chinese area: Chinese official https://t.co/UvQkz1xnrh https://t.co/y2FfutoAg7',http://pbs.twimg.com/media/DGvr8j0UAAEIqDi.jpg
895048939887407104,2017-08-08 22:27:51,b'Master strategist @ahmedpatel gets one over @AmitShah https://t.co/0GgzmiUQNc https://t.co/MBe2MVgcfj',http://pbs.twimg.com/media/DGvaPuxU0AA0ypr.jpg
895038709665382402,2017-08-08 21:47:12,"b'In Gujarat RS seat cliffhanger, Sonia\xe2\x80\x99s top adviser snatches victory off last ball https://t.co/DGu1ys0lhA https://t.co/ZGWO23yiXY'",http://pbs.twimg.com/media/DGvQ5j9UMAAegbO.jpg
895004189658673154,2017-08-08 19:30:01,"b""'No water, electricity to rain hit villagers from three days\xe2\x80\x99 https://t.co/8OEKe8M1tx via @TOICitiesNews https://t.co/G9khn2qHI6""",http://pbs.twimg.com/media/DGtzV1bUAAApJI_.jpg
894996637893906432,2017-08-08 19:00:01,b'Qatar Airways offers free extra baggage for India students flying abroad https://t.co/H0HaF20DM1 via @TOIMumbai https://t.co/FcGvOLb6kl',http://pbs.twimg.com/media/DGtzKynVoAIhQ_x.jpg
894992861896298498,2017-08-08 18:45:01,"b'21 Green Nobel winners join Chomsky, speak for Narmada victims https://t.co/OyvNgHk3yI via @TOIDelhi https://t.co/WKv02ONKaw'",http://pbs.twimg.com/media/DGtz7dPVYAAA68o.jpg
894989088062832645,2017-08-08 18:30:01,b'Over 600km of river stretches in TN polluted https://t.co/21BOWsvzbV via @TOIChennai\n\n(Representative Image) https://t.co/X9Yy28CVy7',http://pbs.twimg.com/media/DGtwhNrUIAErJdr.jpg
894985311029264385,2017-08-08 18:15:00,"b'Harassed by in-laws, woman jumps to death in canal with two kids https://t.co/m6JcTCjSnJ via @TOICitiesNews https://t.co/vfFeb31k7Z'",http://pbs.twimg.com/media/DGttdVeUQAAnKeG.jpg
894981536524754944,2017-08-08 18:00:00,b'Investor wealth plummets by Rs 1.43 lakh crore as markets stumble https://t.co/vjvpmx17wL via @TOIBusiness https://t.co/ntxjSqzayH',http://pbs.twimg.com/media/DGtuLkNVoAAmRLQ.jpg
894973255592722432,2017-08-08 17:27:06,"b""VIVO Pro Kabaddi: @HaryanaSteelers end Gujarat Fortunegiants' unbeaten run https://t.co/j2zzaZGQgj via @TOISports https://t.co/Q7tSd9kH5C""",http://pbs.twimg.com/media/DGuVY6LVoAE2Ucv.jpg
894972770085330944,2017-08-08 17:25:10,b'Amit Shah completes three years as BJP chief tomorrow \n\nRead more: https://t.co/DJT3jtcSHi https://t.co/Bhnz0KMD6y',http://pbs.twimg.com/amplify_video_thumb/894971334597394432/img/qCSiAo0Bf7ZKz_41.jpg
894967161399070720,2017-08-08 17:02:53,"b'Gujarat Rajya Sabha poll counting delayed; Congress, BJP rush to EC 3 times each https://t.co/RRoFnemeiP https://t.co/bAozYFKKu3'",http://pbs.twimg.com/media/DGuP4ZcU0AEyY28.jpg
894963926433013760,2017-08-08 16:50:02,b'Tillerson visits Thailand to firm up bilateral relations \n\nRead more: https://t.co/P0ymG5b9xq https://t.co/56p5kNtmyK',http://pbs.twimg.com/amplify_video_thumb/894959273465176064/img/DBO6Lw_tB2sHxCUz.jpg
894963471183478784,2017-08-08 16:48:13,"b'Up to 100 feared dead, thousands injured in China earthquake: Government https://t.co/vBifjf1wuK via @TOIWorld https://t.co/NRm6DJlGnF'",http://pbs.twimg.com/media/DGuKQFhVwAEnP1O.jpg
894959932549742593,2017-08-08 16:34:10,b'.@kynanchenai wins bronze at 7th Asian Shotgun Championship https://t.co/9nbrbM3l2S via @TOISports https://t.co/gqphboPUlf',http://pbs.twimg.com/media/DGuJTMmU0AAsQZ9.jpg
894955115123232773,2017-08-08 16:15:01,"b'Bypassing SC fiat, Karnataka plans ordinance on SC/ST promotion https://t.co/5VgtAFEmFU via @TOIBengaluru https://t.co/birog8Cn1u'",http://pbs.twimg.com/media/DGt9T5ZUAAEAdB_.jpg
894951344947294209,2017-08-08 16:00:02,b'CBI approaches four countries for assistance in Antrix-Devas probe https://t.co/7d2nzOq8BF https://t.co/0n31Mi6iSb',http://pbs.twimg.com/media/DGtq8aTVoAA4BFn.jpg
894946046308106240,2017-08-08 15:38:59,"b""Guitar-slinging granny's video goes viral on YouTube https://t.co/Wstd7OjRDt @gadgetsnow https://t.co/C5bDEtIuKt""",http://pbs.twimg.com/media/DGt8gg6V0AEjh_y.jpg
894943795879587840,2017-08-08 15:30:02,b'Ready to include Urdu in NEET from new session: Centre to SC https://t.co/5uB8K0zpC4 https://t.co/wpoUdnsGYS',http://pbs.twimg.com/media/DGtYYjIUwAAUekH.jpg
894940015242891265,2017-08-08 15:15:01,b'.@anilkumble1074 gets his dues post acrimonious exit as India head coach https://t.co/n4bYvK7fFA via @TOISports https://t.co/0gRLbZQFYm',http://pbs.twimg.com/media/DGtqHdPUwAASFz2.jpg
894936240344182784,2017-08-08 15:00:01,b'Villagers pledge to get tipplers arrested https://t.co/5joY0uxcax via @TOICitiesNews https://t.co/9pp1mvAuz8',http://pbs.twimg.com/media/DGtGMUvUIAIEomO.png
894931209729396737,2017-08-08 14:40:02,b'Government plans 24X7 virtual fence along Indo-Pak border \n\nRead more: https://t.co/5H4zx4ZETF https://t.co/cNlbtXjQTM',http://pbs.twimg.com/amplify_video_thumb/894894155343683586/img/8meYiCSK_yqDNan9.jpg
894928688478920705,2017-08-08 14:30:00,b'Justice Dipak Mishra to be next Chief Justice of India https://t.co/K8XJb8TosY https://t.co/HE1G6hbYV1',http://pbs.twimg.com/media/DGtpgMfUwAENbi6.jpg
894924916952322050,2017-08-08 14:15:01,b'Gujarat Rajya Sabha polls: JD(U) MLA says he voted for Ahmed Patel https://t.co/ENfh3xowFo via @TOIAhmedabad https://t.co/c4sTAKJb9P',http://pbs.twimg.com/media/DGtorBsUwAE4AD9.jpg
894923716601106434,2017-08-08 14:10:15,"b'Why should I hide? I am the survivor, not the accused, says Varnika Kundu \n\nRead more: https://t.co/5khOODsFKr https://t.co/86XTdYmD8u'",http://pbs.twimg.com/amplify_video_thumb/894922608776314880/img/R11D-G9f6BxgPXAK.jpg
894923161807998976,2017-08-08 14:08:03,b'Gujarat RS polls: Counting delayed as Congress asks EC to reject votes of 2 rebel MLAs https://t.co/sBeLbHuAL3 https://t.co/Z31gElR9IR',http://pbs.twimg.com/media/DGtn1gcU0AATVCC.jpg
894917365250408450,2017-08-08 13:45:01,"b'Businesses can file returns, pay taxes for July on GSTN portal https://t.co/0EpkLcbh41 via @TOIBusiness https://t.co/9LRgXi0ofz'",http://pbs.twimg.com/media/DGtUK_3U0AASDs7.jpg
894913588145606657,2017-08-08 13:30:00,b'Doctor turns hero after he treats coma patient for free https://t.co/1OjeyFWC03 via @TOILucknow https://t.co/i4p9augbIv',http://pbs.twimg.com/media/DGtFkxzU0AAYawW.jpg
894909819437498370,2017-08-08 13:15:02,"b'New Rs 500, 2000 notes have unique dimension: Government https://t.co/0oljRc7piH via @TOIBusiness https://t.co/rp939uX9ZD'",http://pbs.twimg.com/media/DGtQhUwUwAExBnR.jpg
894906050096152577,2017-08-08 13:00:03,"b""US orangutan Chantek, 'the ape who went to college,' dies at 39 https://t.co/miyXSNuj7E via @TOIWorld https://t.co/HZfMBFyYAB""",http://pbs.twimg.com/media/DGtNAGhUAAAlX9a.jpg
894903245444792320,2017-08-08 12:48:54,"b""7 things that iPhones can do, Android phones can't https://t.co/ZnenAedebG via @gadgetsnow https://t.co/yeMNRWgned""",http://pbs.twimg.com/media/DGtVu06VwAIs8ao.jpg
894902265978396674,2017-08-08 12:45:01,b'@TVSMotor launches Jupiter Classic Edition Scooter: Price and other details https://t.co/Ge4WihkJQD via @TOIAuto https://t.co/7X5cYSMUzX',http://pbs.twimg.com/media/DGtKgPgUAAAqBBp.jpg
894899926777217024,2017-08-08 12:35:43,b'Take a look at all the top stories in 60 seconds https://t.co/uA0RPVtywN',http://pbs.twimg.com/media/DGtSnGQVYAA5d4g.jpg
894894716042399745,2017-08-08 12:15:01,b'.@AxisBank cuts interest rate on savings bank account https://t.co/iIzgw8B8Px via @TOIBusiness https://t.co/1BuSmsBM8b',http://pbs.twimg.com/media/DGtLwoQVoAAkEQV.jpg
894893455259783168,2017-08-08 12:10:00,b'.@airtelindia offering 84GB data to prepaid users at Rs 399 https://t.co/cqHODgEf9p via @gadgetsnow https://t.co/sRmI5RBuXv',http://pbs.twimg.com/media/DGtMSrWVoAAZa-l.jpg
894889216357711872,2017-08-08 11:53:10,b'Write India Season 2 campaign - Write with the Writers https://t.co/Mqs8b7157u https://t.co/csPdxOrUsY',http://pbs.twimg.com/media/DGtIWNOVYAArdTO.jpg
894887164579893248,2017-08-08 11:45:00,"b""Ensure safety of customers' lockers: @RBI to banks https://t.co/TEB5B2su50 via @TOIBusiness https://t.co/PcXUrYQacP""",http://pbs.twimg.com/media/DGtCLaZVYAAni01.jpg
894883393078530048,2017-08-08 11:30:01,"b""Delhi man crushes wife's head with cylinder as kids look on https://t.co/nmIYYc1g6g via @TOIDelhi https://t.co/xj79mYDmn3""",http://pbs.twimg.com/media/DGs7rL0U0AEjcUl.jpg
894880873941782528,2017-08-08 11:20:01,b'Tamil Nadu accident victim dies as 5 Kerala hospitals deny treatment https://t.co/CTAzPw5uRX via @TOICitiesNews https://t.co/Ck6eALxl7x',http://pbs.twimg.com/media/DGs61WqV0AAuKD4.jpg
894878355773952000,2017-08-08 11:10:00,"b""Sedition charge against man for 'I support Pak' picture on Facebook https://t.co/gzuwLuqroF via @TOICitiesNews https://t.co/242dgptKGr""",http://pbs.twimg.com/media/DGs53gJVoAA3hrC.jpg
894875849522003968,2017-08-08 11:00:03,b'Kannada Development Authority to bank staff: Learn Kannada or go https://t.co/jrlCicLNMj via @TOIBengaluru https://t.co/kRAhnZ93Vn',http://pbs.twimg.com/media/DGs4-tcUIAESPI3.jpg
894875845394812929,2017-08-08 11:00:02,b'IT professional held for stalking fashion designer in Andheri https://t.co/gG99x1YAS1 via @TOIMumbai https://t.co/8H7rrikDN0',http://pbs.twimg.com/media/DGs5HXzUIAA-UoJ.jpg
894873323963895808,2017-08-08 10:50:01,"b'Auto driver returns Rs 4 lakh jewellery, gets a \xe2\x80\x98sister\xe2\x80\x99 https://t.co/HSHxwxTv36 via @TOIMumbai https://t.co/LWeUUQqF7V'",http://pbs.twimg.com/media/DGs3wyCUQAAjPo2.jpg
894872065936834560,2017-08-08 10:45:01,"b""Rahul 'missing' posters appear in Amethi; Congress blames BJP, RSS https://t.co/z1Wopq8xPU https://t.co/jZ4dFOPTj7""",http://pbs.twimg.com/media/DGs2_faUwAExL4F.jpg
894868612518785025,2017-08-08 10:31:17,"b""'Mosque can be built at a reasonable distance from Ram Janmabhoomi,' says Shia Wakf Board https://t.co/T0wSRzOTpx https://t.co/4mxo1ZZXhX""",http://pbs.twimg.com/media/DGs2QJuUwAAqaOs.jpg
894868293168898048,2017-08-08 10:30:01,"b""Haryana stalking incident: 'Varnika is like my daughter', says BJP's Subhash Barala https://t.co/RHWdlrN2oy https://t.co/IkWYiGusC1""",http://pbs.twimg.com/media/DGsu2XOUAAAgh4f.jpg
894868254514069505,2017-08-08 10:29:52,b'Twitter users take potshots at BJP for attempts to shame Varnika Kundu https://t.co/6voG02jkeo https://t.co/DNuZTgfn5c',http://pbs.twimg.com/media/DGs1wZrUQAAVu4w.jpg
894866833689329665,2017-08-08 10:24:13,"b'SEBI scanner on shell companies hit hard; Sensex, Nifty face heavy losses https://t.co/tcfiordOra via @TOIBusiness https://t.co/u1XF4JJfv2'",http://pbs.twimg.com/media/DGs0hEuUMAAZmOu.jpg
894865776045301760,2017-08-08 10:20:01,b'Government plans 24X7 virtual fence along Indo-Pak border https://t.co/5H4zx4ZETF https://t.co/MtUCtIOExc',http://pbs.twimg.com/media/DGsuKXwVYAA987c.jpg
894864458090029056,2017-08-08 10:14:47,"b""Trai raps Apple for 'colonising data' in India, says it's anti-customer\n\nRead more at https://t.co/1N32sdNJBL https://t.co/HR0hSy5FXf""",http://pbs.twimg.com/amplify_video_thumb/894863839342112768/img/TnhqbTJuCH5L3du7.jpg
894864215592230912,2017-08-08 10:13:49,"b'After Malabar, India, US gear up for September military drill\n\nRead more at https://t.co/dgADSoZKab https://t.co/0f3Q1zMhKi'",http://pbs.twimg.com/amplify_video_thumb/894863882719600641/img/ju-jM9B747p-DSy8.jpg
894863256002547713,2017-08-08 10:10:00,b'Egyptian man starts minicar business to take on Chinese Tuk Tuk https://t.co/lgWiQ3miGG via @TOIAuto https://t.co/2dWvAowxdR',http://pbs.twimg.com/media/DGstQBRUQAEoeMZ.jpg
894861488870916099,2017-08-08 10:02:59,b'Festivities may fizzle out as Hills stare at Rs 75 crore Puja loss https://t.co/fCYejEGlvK via @TOICitiesNews https://t.co/tvL32pTdHI',http://pbs.twimg.com/media/DGsvvwQUAAAVle1.jpg
894860754058399745,2017-08-08 10:00:04,b'Article 35A and its significance https://t.co/FsCCTklpIs https://t.co/akHfeDf0zj',http://pbs.twimg.com/media/DGsrQ0IUMAEHqiy.jpg
894858222217154560,2017-08-08 09:50:00,b'Opposition: Govt printed different types of currency notes https://t.co/RFFLq1NGCt https://t.co/lGg60XT7pa',http://pbs.twimg.com/media/DGsq0QSVwAEJDYJ.jpg
894854906544128000,2017-08-08 09:36:49,"b'Gujarat Rajya Sabha polls: Cross-voting hits Congress, close contest for Ahmed Patel https://t.co/2okPYcWyzj https://t.co/brHpHFEkDl'",http://pbs.twimg.com/media/DGspwZ8VwAAMPM2.jpg
894850674625622016,2017-08-08 09:20:01,b'Govindas on a high after height cap goes https://t.co/NVvCYgiOdf via @TOIMumbai https://t.co/arv6tl5zAS',http://pbs.twimg.com/media/DGskDDJVYAEh-ln.jpg
894848158022328321,2017-08-08 09:10:01,"b""2 held at Pune airport with Rs 1.3 crore forex in 'upma' https://t.co/JjuHueiyUn via @TOICitiesNews https://t.co/l7Uu9DaJjG""",http://pbs.twimg.com/media/DGsjWCVVwAAjTWj.jpg
894845651049172992,2017-08-08 09:00:03,b'How Steve Jobs saved Apple from disaster https://t.co/xXgiaeI8pi via @gadgetsnow https://t.co/1IP6uKckKr',http://pbs.twimg.com/media/DGsd2K5VYAEGneJ.jpg
894843124551262209,2017-08-08 08:50:00,b'US may lose its competitive edge due to H-1B clampdown: Report https://t.co/U8HgsIFpJ2 via @TOIBusiness https://t.co/UQBzo6d9pM',http://pbs.twimg.com/media/DGsdWAWVoAEwfbR.jpg
894841063919165441,2017-08-08 08:41:49,"b""Special status to Jammu and Kashmir: SC seeks Centre's reply https://t.co/RLWxs6tF2S https://t.co/1OhVXxXxwJ""",http://pbs.twimg.com/media/DGsdLsoVYAAlqtl.jpg
894839764574126080,2017-08-08 08:36:39,"b'BJP-RSS tried to kill Rahul Gandhi, they want to eliminate him: @laluprasadrjd on attack on Congress VP (ANI) https://t.co/7Mq46uWaFZ'",http://pbs.twimg.com/media/DGsb92AUAAAlTpp.jpg
894838092783288321,2017-08-08 08:30:01,b'Mom-in-law backs woman; son to pay Rs 4 crore alimony https://t.co/dzv4648GRa via @TOIBengaluru https://t.co/3AE9keS8PX',http://pbs.twimg.com/media/DGsTn2vVYAE941p.jpg
894835573747331072,2017-08-08 08:20:00,b'Supreme Court says no to compulsory Yoga education in schools https://t.co/6zNXmSi0HZ https://t.co/fO9HfziDuq',http://pbs.twimg.com/media/DGsSwJYVwAA0PFq.jpg
894833055923359744,2017-08-08 08:10:00,b'Hackers demand millions in ransom for stolen HBO data https://t.co/PqRzMUXY5E via @toitv https://t.co/QYXKrPR3w7',http://pbs.twimg.com/media/DGsNlXzVwAA0I34.jpg
894831923234615297,2017-08-08 08:05:30,b'Supreme Court refuses to modify its order over Sardar Sarovar Dam issue in Gujarat: ANI https://t.co/wcoPM3IDyT',http://pbs.twimg.com/media/DGsU4fpVYAAAi3r.jpg
894830544768258050,2017-08-08 08:00:01,"b""Army-basher  Khawaja Muhammad Asif is Pakistan's foreign minister https://t.co/kCrnD4mgII via @TOIWorld https://t.co/CBJYitvWoo""",http://pbs.twimg.com/media/DGsMoNbVYAEEOe4.jpg
894829208836333570,2017-08-08 07:54:43,b'Triumph motorcycles &amp; Bajaj Auto tie up https://t.co/x3kf7qJXnw via @TOIBusiness https://t.co/yHr9pyJnhY',http://pbs.twimg.com/media/DGsSal_UQAAbjET.jpg
894828022926385155,2017-08-08 07:50:00,b'Sebi asks bourses to act against 331 suspected shell companies https://t.co/2ZwwpP5PWX via @TOIBusiness https://t.co/hO9vZ9WTou',http://pbs.twimg.com/media/DGsK_P3VYAAHWlZ.jpg
894825507593662464,2017-08-08 07:40:00,"b""Gujarat RS poll: 'You are a Rajput', says @digvijaya_28 to Shankersinh Vaghela https://t.co/AQTd5KTDPy https://t.co/uKVjnRbD04""",http://pbs.twimg.com/media/DGsJT0cUQAEIdt_.jpg
894820474781184001,2017-08-08 07:20:00,"b'To get the hire right, startups expand background checks https://t.co/squ4gOJkF1 via @TOIBusiness https://t.co/vplznX1q8h'",http://pbs.twimg.com/media/DGsH29PVwAAHBKw.jpg
894817958106628096,2017-08-08 07:10:00,b'Frequent changes in tax rates hit planning: Auto industry https://t.co/tgy5aEVzzK via @TOIAuto https://t.co/Ly3c4OcIoO',http://pbs.twimg.com/media/DGsDhTdUIAA8alS.jpg
894815440429490176,2017-08-08 07:00:00,"b""Cops get footage of duo 'chasing' Varnika Kundu https://t.co/F9eIFpCEKe via @TOICitiesNews https://t.co/0VaHgXS1GJ""",http://pbs.twimg.com/media/DGr_5_6UQAAV64A.jpg
894812925466103808,2017-08-08 06:50:00,b'J&amp;K braces for unrest over Article 35A https://t.co/LdQ5vvSxL9 via @TOICitiesNews https://t.co/qkRD5nBYQ3',http://pbs.twimg.com/media/DGr_fQmUAAEJ9pB.jpg
894810407461732352,2017-08-08 06:40:00,b'Saira Banu: Dilip Sahab is much improved by the grace of God https://t.co/hzicWlg9Uk via @TOIEntertain https://t.co/C9h6nB2tna',http://pbs.twimg.com/media/DGr-rusUMAAc1CK.jpg
894804678067724288,2017-08-08 06:17:14,b'Lenovo testing \xe2\x80\x98K8 Plus\xe2\x80\x99 smartphone in India https://t.co/QViGzkzAGE via @gadgetsnow https://t.co/bH5Nxs1KOv',http://pbs.twimg.com/media/DGr8G2-VoAceFd3.jpg
894802944876355584,2017-08-08 06:10:21,"b'After Malabar, India, US gear up for September military drill https://t.co/dgADSoZKab \n(Representative Image) https://t.co/ONV5A3WFDR'",http://pbs.twimg.com/media/DGr6dMmVoAAjqqH.jpg
894800340939403264,2017-08-08 06:00:00,b'China bid to play on Nepal fears on Indian aggression https://t.co/yQl4n6QkZI https://t.co/YJMclV6sHi',http://pbs.twimg.com/media/DGr0_f1VYAA3UK6.jpg
894797824633778176,2017-08-08 05:50:00,b'Yoga education not fundamental right: Centre https://t.co/dUpDQK5Jlb https://t.co/xPA5xE0T43',http://pbs.twimg.com/media/DGr0L26V0AAj44s.jpg
894795308894257153,2017-08-08 05:40:00,b'Mughalsarai: A reminder of Mughal-era hospitality and British-built railways https://t.co/h7ASlKMX5S https://t.co/fr122VhAJn',http://pbs.twimg.com/media/DGrwEGeUMAAiyLz.jpg
894792792014237696,2017-08-08 05:30:00,b'IT professionals shelling out up to Rs 4 lakh to reskill https://t.co/Qojx6hSdMJ via @TOIBusiness https://t.co/KK07FabGTb',http://pbs.twimg.com/media/DGrrR62UwAABuur.jpg
894790277101043713,2017-08-08 05:20:01,b'I-T returns up 25% as more individuals declare income https://t.co/AmZovbjnFi via @TOIBusiness https://t.co/uNy78Kd9gT',http://pbs.twimg.com/media/DGrqlfuVoAAGPcg.jpg
894787761588248576,2017-08-08 05:10:01,b'Centre issues guidelines for diverting forest land https://t.co/6TW5Shz7VR https://t.co/mnN7SjDP4D',http://pbs.twimg.com/media/DGrqPFIU0AALXhK.jpg
894785244359925768,2017-08-08 05:00:01,"b'Delhi: Parking row triggers stabbing spree, 5 hurt https://t.co/eQjIx0R4yf via @TOIDelhi https://t.co/JUblzxNW8M'",http://pbs.twimg.com/media/DGrlDm4VYAA7EvM.jpg
894783426716246016,2017-08-08 04:52:47,b'Take a look at all the top news stories in 60 seconds https://t.co/nPCNK4WVZy',http://pbs.twimg.com/media/DGrouFIVwAAhFJV.jpg
894782726208864258,2017-08-08 04:50:00,"b'CISF personnel lose salaries from accounts, cops look for leads https://t.co/uEo4xW0h0J via @TOIDelhi https://t.co/QNWl0JHuka'",http://pbs.twimg.com/media/DGrkt2FV0AAU-rC.jpg
894781677548879872,2017-08-08 04:45:50,b'Infographic | Battle for Gujarat Rajya Sabha seat  https://t.co/f47gR3xpoO https://t.co/WwI3nHG6vR',http://pbs.twimg.com/media/DGrnLzTUAAA63LN.jpg
894777691362258944,2017-08-08 04:30:00,"b""Trai raps Apple for 'colonising data' in India, says it's anti-customer https://t.co/1N32se5l0l via @TOIBusiness https://t.co/vEIhQr6w3a""",http://pbs.twimg.com/media/DGrfjfnU0AEUgUf.jpg
894772658948104192,2017-08-08 04:10:00,b'Rajya Sabha election in Gujarat: Top developments https://t.co/QG19OmJ7I0 https://t.co/ptzxDSuNeq',http://pbs.twimg.com/media/DGrd4naVwAIkxgS.jpg
894770145268289537,2017-08-08 04:00:01,b'Blog | Pakistani soap episode 2 https://t.co/OtYR6LNcTG via @TOIOpinion https://t.co/beNpm2R65X',http://pbs.twimg.com/media/DGrJSjBUMAEovth.jpg
894765989828493317,2017-08-08 03:43:30,b'#RajyaSabhaPolls Shankersinh Vaghela arrives for voting at Gujarat assembly: ANI https://t.co/GKoCwNsEtQ https://t.co/0DybzapbaR',http://pbs.twimg.com/media/DGrY5rRUMAAQ8HF.jpg
894760079190142980,2017-08-08 03:20:01,"b'TOI Edit | Mass delusions are symptoms of social stress, which really do need remedying: https://t.co/2XrrRfFNHT https://t.co/m5nO4uivBc'",http://pbs.twimg.com/media/DGrSa2WVoAAaZ_K.jpg
894755674051141633,2017-08-08 03:02:31,"b'Miracle operation in India, baby dies in Pakistan https://t.co/rIJfJAKuCQ via @TOIHyderabad https://t.co/7h9LXcNFJN'",http://pbs.twimg.com/media/DGrPhzMU0AE4h0l.jpg
894752356453056512,2017-08-08 02:49:20,b'Amit vs Ahmed battle today; Vaghela holds the key https://t.co/GVapmXyL9m https://t.co/BZ8KWvmtB7',http://pbs.twimg.com/media/DGrMfW7VoAANi8m.jpg
894749718302957569,2017-08-08 02:38:51,b'Amit Shah\xe2\x80\x99s entry to boost BJP\xe2\x80\x99s Rajya Sabha heft https://t.co/rZ2MPyfNng https://t.co/2A4rPnvC1y',http://pbs.twimg.com/media/DGrKGW9VwAEI6DR.jpg
894734821636755457,2017-08-08 01:39:39,b'Doklam standoff: Beijing briefs former Nepal PM KP Oli\nhttps://t.co/NhL4jJTrIy https://t.co/Rpph8aHsqP',http://pbs.twimg.com/media/DGq8eemUAAAFUzl.jpg
894727217053188098,2017-08-08 01:09:26,b'Centre issues guidelines for diverting forest land https://t.co/6TW5Shz7VR https://t.co/Amkdhuc2ss',http://pbs.twimg.com/media/DGq1o3LVwAAiC3d.jpg
894715334548115457,2017-08-08 00:22:13,b'Yoga education not fundamental right: Centre https://t.co/dUpDQJO7WB https://t.co/xwIYltEmTu',http://pbs.twimg.com/media/DGqq2IMVwAQifyZ.jpg
894706537867784192,2017-08-07 23:47:16,b'@AmitShah vs Ahmed battle today; Vaghela holds the key https://t.co/GVapmXyL9m https://t.co/tIyWQINM9f',http://pbs.twimg.com/media/DGqiq6GV0AEETTw.jpg
894698570581852160,2017-08-07 23:15:36,b'J&amp;K braces for unrest over Article 35A https://t.co/LdQ5vvSxL9 https://t.co/fq9LCtSIbM',http://pbs.twimg.com/media/DGqbmWwVwAAypfx.jpg
894690715338391552,2017-08-07 22:44:23,"b'Why should I hide? I am the survivor, not the accused, says Chandigarh braveheart Varnika https://t.co/5khOODsFKr https://t.co/oBWi28pNli'",http://pbs.twimg.com/media/DGqUcOhUIAAOkMR.jpg
894676769822855168,2017-08-07 21:48:58,"b"".@AmitShah's entry to boost BJP\xe2\x80\x99s Rajya Sabha heft https://t.co/rZ2MPyfNng https://t.co/ojqThhB0SK""",http://pbs.twimg.com/media/DGqHwxoVYAAaG09.jpg
894665516245147648,2017-08-07 21:04:15,"b'After Malabar, India &amp; US gear up for September military drill https://t.co/dgADSoZKab https://t.co/AsNupqH0kI'",http://pbs.twimg.com/media/DGp9hrdUwAA7Tes.jpg
894652646119809025,2017-08-07 20:13:07,"b""Trai raps @Apple for 'colonising data' in India, says it's anti-customer https://t.co/1N32sdNJBL https://t.co/3BcwfyM8X3""",http://pbs.twimg.com/media/DGpxzCyUAAAfGV6.jpg
