id,created_at,text,media_url
893343239759114240,2017-08-04 05:30:00,b'AI\xe2\x80\x99s Varanasi-Colombo maiden flight takes wing https://t.co/BqjIFCjD38 via @TOICitiesNews https://t.co/PPDGnH8fRy',http://pbs.twimg.com/media/DGXH2T1UAAAtH6C.jpg
893340723193544704,2017-08-04 05:20:00,b'Shiva Kumar found tearing pages from a diary: I-T dept https://t.co/qOi9cwL6sN https://t.co/BEayasSl76',http://pbs.twimg.com/media/DGXEUecUMAAvrk4.jpg
893338207156412417,2017-08-04 05:10:00,b'Neymar completes record 222m euros PSG move https://t.co/5k0NCgOmLj via @TOISports https://t.co/cUc40cA9Gc',http://pbs.twimg.com/media/DGXA-nmUAAAfn77.jpg
893335690598948864,2017-08-04 05:00:00,b'IITian arrested in Bengaluru for stealing Aadhaar data https://t.co/gJU3VuWvjA via @TOIBengaluru https://t.co/obAvoVfCvo',http://pbs.twimg.com/media/DGXAQGvUwAAC-AR.jpg
893333173605675008,2017-08-04 04:50:00,b'Lion population roars to 650 in Gujarat forests https://t.co/sXaLdvscBG via @TOIAhmedabad https://t.co/Z459NBnrFR',http://pbs.twimg.com/media/DGXADj7V0AAe7vz.jpg
893330656608092160,2017-08-04 04:40:00,"b""Congress borrows BJP's Twitter quiz idea, gets trolled https://t.co/HP9ccuKKlV https://t.co/cdpgx4S90E""",http://pbs.twimg.com/media/DGW-SUXUIAA_g1u.jpg
893328139987951616,2017-08-04 04:30:00,b'Tatas explore sale of telecom assets to RIL https://t.co/33HdLsWRh4 via @TOIBusiness https://t.co/dpJKPxMiN2',http://pbs.twimg.com/media/DGW8Y5vUAAElCHX.jpg
893325738593603584,2017-08-04 04:20:27,"b'Jet follows Air India, curtails menu on domestic flights https://t.co/hlQjnilwev via @TOIBusiness https://t.co/NO3OvJr8RF'",http://pbs.twimg.com/media/DGW7AibV0AAOzbo.jpg
893323107963817984,2017-08-04 04:10:00,"b'14 properties of Geelani, kin worth Rs 150 crore under NIA lens https://t.co/HL1oLQVfCu https://t.co/7lzw3wupw3'",http://pbs.twimg.com/media/DGW1yWLXkAAIkR7.jpg
893320594178977792,2017-08-04 04:00:01,b'EAM @SushmaSwaraj slams Rahul Gandhi for meeting Chinese envoy https://t.co/lMhFWR5yI9 https://t.co/fOQxMEY3ov',http://pbs.twimg.com/media/DGW0dzqUIAAu-Db.jpg
893318073817628673,2017-08-04 03:50:00,b'One Hizbul Mujahideen terrorist killed in encounter in Anantnag in Jammu and Kashmir https://t.co/jz13aXZFEr https://t.co/Vy6NgOQvsh',http://pbs.twimg.com/media/DGWz17lU0AIR3FM.jpg
893315558367571969,2017-08-04 03:40:00,"b'China talks tough, but hope of Doklam thaw https://t.co/xlnm4NUyom https://t.co/R7BTGZH3km'",http://pbs.twimg.com/media/DGWuUj4UwAAW7rl.jpg
893315557059158016,2017-08-04 03:40:00,b'Molestation case: Singer Yash Wadali held https://t.co/8qcHXO6tIW via @TOIMumbai https://t.co/KqQZ9e2guk',http://pbs.twimg.com/media/DGWsjn6UMAAR1S4.jpg
893299378961698818,2017-08-04 02:35:43,b'Migrating to United States likely to get easier for educated Indians https://t.co/tquM0FKohW via @TOIWorld https://t.co/XsnHpYlrub',http://pbs.twimg.com/media/DGWjC0qUAAEL5rU.jpg
893290398726094849,2017-08-04 02:00:02,"b'Against rule of 105 bags a day, FCI \xe2\x80\x98baahubalis\xe2\x80\x99 handled 1,776 https://t.co/Eu52u8pWmH https://t.co/mXJIvEpQbD'",http://pbs.twimg.com/media/DGVkDT-UQAAWw6n.jpg
893282841773166592,2017-08-04 01:30:00,b'UIDAI chief: No breach of data in Aadhaar theft case https://t.co/8Nzw1VSekN https://t.co/SrVvicIZsB',http://pbs.twimg.com/media/DGVjptJV0AEXQxN.jpg
893275296610344960,2017-08-04 01:00:01,b'BJP ups ante against CPM on violence in Kerala https://t.co/KMWjnCBovc https://t.co/veJQWmJLtp',http://pbs.twimg.com/media/DGVjUyaUIAEFCrY.jpg
893267746363854848,2017-08-04 00:30:01,b'Over 37% of schools in India have no electricity https://t.co/8FpaiN5gEN https://t.co/lm4EPK2oWP',http://pbs.twimg.com/media/DGVi_UGV0AAkB-y.jpg
893260193261395968,2017-08-04 00:00:00,b'Women\xe2\x80\x99s hockey star found dead on railway tracks https://t.co/N18nYB061V https://t.co/IoisyHhreZ',http://pbs.twimg.com/media/DGViu6dUAAAw24Q.jpg
893252646387240960,2017-08-03 23:30:01,b'Tatas explore sale of telecom assets to RIL https://t.co/33HdLsWRh4 https://t.co/IrpMt9N2RL',http://pbs.twimg.com/media/DGViYhhVwAAeOPK.jpg
893245103011237893,2017-08-03 23:00:02,"b'Army Major, soldier killed in Shopian ambush https://t.co/LnKyxFsEOV https://t.co/vgHSUNqRtd'",http://pbs.twimg.com/media/DGViOg3UwAAzp20.jpg
893237545491988480,2017-08-03 22:30:01,b'Shiva Kumar found tearing pages from a diary: I-T dept https://t.co/qOi9cwL6sN https://t.co/w78PhF8RR5',http://pbs.twimg.com/media/DGViFC9UAAEJ8U5.jpg
893229993639149568,2017-08-03 22:00:00,"b'China talks tough, but hope of Doklam thaw https://t.co/xlnm4NCXwO https://t.co/tSVV8QbnNI'",http://pbs.twimg.com/media/DGVh5UvUQAAetvH.jpg
893170167986872320,2017-08-03 18:02:17,"b'Heavy rain in Himachal, 2 flood-hit Gujarat districts declared disaster-affected https://t.co/33QbTGccP4 https://t.co/CnueLgFcub'",http://pbs.twimg.com/media/DGUthXIUAAEcMfV.jpg
893170088773156865,2017-08-03 18:01:58,"b""Hiker's close encounter with snake goes viral https://t.co/xi4WvA6kkI https://t.co/FXcq9ZJ1tg""",http://pbs.twimg.com/media/DGUtctnU0AANLob.jpg
893165196021125120,2017-08-03 17:42:31,b'.@isro to sign MoU with CSIR-NPL to make desi GPS a reality soon https://t.co/v1UFco3ieq https://t.co/MGeZLLlQcQ',http://pbs.twimg.com/media/DGUpAIpUwAAYuU8.jpg
893163505209139200,2017-08-03 17:35:48,b'No question of forming a new party: JD(U) leader Sharad Yadav https://t.co/XvqWYNojqU https://t.co/vX80ivtZWV',http://pbs.twimg.com/media/DGUnd4yVoAAStQp.jpg
893157394468839424,2017-08-03 17:11:31,"b""Daman and Diu orders 'brotherly love', employees say 'no, thank you' https://t.co/Yten7cFUqF https://t.co/iJ2xG3gRND""",http://pbs.twimg.com/media/DGUh6PtV0AAwIe9.jpg
893154513930117121,2017-08-03 17:00:04,b'2 IIT aspirants go missing within two days in Kota https://t.co/Gwg1iL4gqj via @TOICitiesNews https://t.co/WGQjj1pn4t',http://pbs.twimg.com/media/DGUc54OU0AAffrR.jpg
893150737936531458,2017-08-03 16:45:04,b'Dialogue can start the day Pakistan stops promoting terror against India: @SushmaSwaraj https://t.co/K4y7ZMQRGi https://t.co/cODpSCPGFo',http://pbs.twimg.com/media/DGUb2lCV0AER6p8.jpg
893143171559018496,2017-08-03 16:15:00,"b""Nawaz Sharif's exit will bring uncertainties to CPEC: Global Times https://t.co/iLf3x7mHCW via @TOIWorld https://t.co/b5iOIIhMhg""",http://pbs.twimg.com/media/DGURPaEVoAAWwm1.jpg
893139415064649729,2017-08-03 16:00:04,"b""This may be 'bad news' for Chinese smartphone makers in India https://t.co/ofjIOqA1dV via @gadgetsnow https://t.co/CjzL9LI4bP""",http://pbs.twimg.com/media/DGURJFZUIAE13hx.jpg
893137904829988868,2017-08-03 15:54:04,b'Infographic | Coal is cooling as renewables pick pace  https://t.co/80TXhc5Ef5 https://t.co/ykqP6LJEEx',http://pbs.twimg.com/media/DGUQLESVoAE0gQ_.jpg
893134176332816386,2017-08-03 15:39:15,"b'Four-year-old girl swallowed Re 1 coin, gets treatment after 7 hours https://t.co/sncF1JDghB via @TOICitiesNews https://t.co/hoqvxIF8Tm'",http://pbs.twimg.com/media/DGUMyxIVoAAOrO3.jpg
893128694293712897,2017-08-03 15:17:28,"b""Russia ties at an 'all-time and very dangerous low': @realDonaldTrump https://t.co/d0SMloBEvL via @TOIWorld https://t.co/u08RZjYItU""",http://pbs.twimg.com/media/DGUHznLV0AAzL-j.jpg
893125588898127872,2017-08-03 15:05:08,"b"".@reliancejio tops Trai's data speed test again https://t.co/YL4p84r2bg via @gadgetsnow https://t.co/rrOxbYwwXu""",http://pbs.twimg.com/media/DGUE-5gV0AQV9gd.jpg
893120522996793344,2017-08-03 14:45:00,"b'War not a solution, diplomacy needed to resolve Doklam crisis: @SushmaSwaraj https://t.co/vYipxm9qQY https://t.co/6Tm3X5pXGi'",http://pbs.twimg.com/media/DGT__ImVoAAOMOC.jpg
893116751180779520,2017-08-03 14:30:01,"b'Four-year-old girl swallowed Re 1 coin, gets treatment after 7 hours https://t.co/sncF1JDghB via @TOICitiesNews https://t.co/4gWSC6neBE'",http://pbs.twimg.com/media/DGT8T6jUMAEb7Od.jpg
893114928810254336,2017-08-03 14:22:46,"b""'Find me a bride': Farmer's plaintive plea to village panchayat https://t.co/kTElz2pdbV via @TOIBengaluru https://t.co/bMIid383Fu""",http://pbs.twimg.com/media/DGT7R4CUIAEmvRu.jpg
893106525207543808,2017-08-03 13:49:23,"b'In a shift, Qatar to offer permanent residency to some https://t.co/eJ6HwcPjux via @TOIWorld https://t.co/Fo3LdjeylT'",http://pbs.twimg.com/media/DGTzpKWVoAY2gfN.jpg
893106043160371200,2017-08-03 13:47:28,b'Rahul Gandhi visits flood-affected Lakhimpur in Assam https://t.co/TyjE18Jv8K https://t.co/vmdYX2SWSG',http://pbs.twimg.com/media/DGTzNMjUAAAxXuq.jpg
893105908649148417,2017-08-03 13:46:56,"b""Opposition to government: What is your road map to deal with 'unusually aggressive' China? https://t.co/Irbnx2H2w0 https://t.co/PlzvxDMqre""",http://pbs.twimg.com/media/DGTpENMUIAAZOXf.jpg
893102988230762496,2017-08-03 13:35:20,"b'Doklam issue can be resolved through talks bilaterally, says @SushmaSwaraj in Rajya Sabha \n\nhttps://t.co/sQZ6WKh8iv https://t.co/8SD8CkMpI3'",http://pbs.twimg.com/media/DGTwbL2UIAAwmHz.jpg
893100134518595584,2017-08-03 13:23:59,b'@SushmaSwaraj .@SushmaSwaraj slams Rahul Gandhi in Rajya Sabha for meeting Chinese envoy \n\nhttps://t.co/sQZ6WKh8iv https://t.co/6yTMhDeO2I',http://pbs.twimg.com/media/DGTt05gUMAASC47.jpg
893098922662436864,2017-08-03 13:19:10,"b""At present, Bhutan is India's dearest friend, says @SushmaSwaraj in Rajya Sabha \n\nhttps://t.co/sQZ6WKh8iv https://t.co/kDlVDS6rhP""",http://pbs.twimg.com/media/DGTstuNVYAAcRnQ.jpg
893097850615209985,2017-08-03 13:14:55,"b'No Indian PM went to Nepal for 17 years, says @SushmaSwaraj in Rajya Sabha\n\nhttps://t.co/sQZ6WKh8iv https://t.co/3UcF3fdHeW'",http://pbs.twimg.com/media/DGTrswJUMAAaR36.jpg
893093139048579072,2017-08-03 12:56:11,"b""Shobhaa De asks women cricketers to not get 'greedy' like Kohli &amp; Co, gets trolled https://t.co/VXYYCEdinL https://t.co/6R4mixm4Dv""",http://pbs.twimg.com/media/DGTnajOUMAIWVyJ.jpg
893090328097439746,2017-08-03 12:45:01,"b'I-T raids on Karnataka minister: Rs 11 crore cash seized till now, searches on https://t.co/AQN64G747x https://t.co/zFrjHasNjy'",http://pbs.twimg.com/media/DGTkggvVwAAoNQJ.jpg
893090173461737473,2017-08-03 12:44:24,b'#TopNews \n\n100 bridges across the country can collapse anytime: @nitin_gadkari https://t.co/9VWi7mFuOD https://t.co/Zsz3aMAxXI',http://pbs.twimg.com/media/DGTkuJdUIAE27sZ.jpg
893083020567101440,2017-08-03 12:15:59,b'Infographic | Which country has the biggest ecological footprint?\n \nhttps://t.co/D2FjBIcUYP https://t.co/zjGjrCQbGj',http://pbs.twimg.com/media/DGTeQgpVYAAp5pQ.jpg
893079014910214145,2017-08-03 12:00:04,"b""Meet @Google's first 19 employees https://t.co/2sBvt7RwWs via @gadgetsnow https://t.co/of4AcLdkVG""",http://pbs.twimg.com/media/DGTTXrsUMAAXl6S.jpg
893067675156582400,2017-08-03 11:15:00,b'Qatar and Italy sign a nearly $6 billion deal for warships https://t.co/vIC3qtGEuJ via @TOIWorld https://t.co/qMbdYOc8Up',http://pbs.twimg.com/media/DGTL_heU0AArTSU.jpg
893063899213377537,2017-08-03 11:00:00,"b""'NaMo sharnam gachhami': @laluprasadrjd on @NitishKumar aligning with the NDA https://t.co/zJZOcja5t0 https://t.co/pB3h7FNwav""",http://pbs.twimg.com/media/DGTJW2sUMAEVBSw.jpg
893057161378398208,2017-08-03 10:33:14,b'China-India border spat casts shadow ahead of #BRICS summit https://t.co/h4wbex1zJx https://t.co/HZy7ulvJmL',http://pbs.twimg.com/media/DGTGqw1V0AApL-R.jpg
893053335799971840,2017-08-03 10:18:02,"b""Bangladesh's 'Sultan of Sex' detained on blackmail charges https://t.co/m2H7TbIMRX via @TOIWorld https://t.co/tsh8dy6YOI""",http://pbs.twimg.com/media/DGTB6HRV0AALikz.jpg
893051108800708608,2017-08-03 10:09:11,b'US honchos throw weight behind new drive to court India https://t.co/NsLupbD9IA via @TOIBusiness https://t.co/lWEY6sjazT',http://pbs.twimg.com/media/DGTBPRvUQAAmyXV.jpg
893045026229563392,2017-08-03 09:45:00,"b"".@iamsrk joins Twitter in praising @GautamGambhir's 'Community Kitchen' service to feed poor https://t.co/WCjSojND2N https://t.co/uWzdZKgYDY""",http://pbs.twimg.com/media/DGS7ReWVwAE-bra.jpg
893041253771866112,2017-08-03 09:30:01,b'Record number of Indians visited Dubai in first half of 2017 https://t.co/C69WwdSvau https://t.co/ijn73Z2ihP',http://pbs.twimg.com/media/DGSuxAjUQAAzR-T.jpg
893035647732072449,2017-08-03 09:07:44,"b""Congress vice president Rahul Gandhi visits flood-affected areas in Assam's Lakhimpur along with villagers: ANI https://t.co/odGMppH5x6""",http://pbs.twimg.com/media/DGSzH28UQAE3LOF.jpg
893033710571982849,2017-08-03 09:00:03,"b'Man kills puppy with cricket bat, goes on the run https://t.co/4EAN20U2nI via @TOIChennai \n\n(Representative Image) https://t.co/UvynEXdrUO'",http://pbs.twimg.com/media/DGSbKZnVYAAvXaR.jpg
893029925107531776,2017-08-03 08:45:00,"b"".@NASA hiring new 'planetary protection officer' to defend Earth from alien matter https://t.co/dJtF7rAyWP https://t.co/2HVKaPOPYA""",http://pbs.twimg.com/media/DGSh9ICVYAACFHS.jpg
893028649179389952,2017-08-03 08:39:56,b'Fake appeals from PM Narendra Modi circulate again on social media \n\nRead more: https://t.co/TWRsaOJYPx https://t.co/8fE6RKb2w5',http://pbs.twimg.com/amplify_video_thumb/893028322006847488/img/14K0c2YWv0noWp0Y.jpg
893027538401804288,2017-08-03 08:35:31,"b""Soon, 'pink auto' app to help women get a safe ride https://t.co/S5tkvpcAaB via @gadgetsnow https://t.co/ZtECohyugg""",http://pbs.twimg.com/media/DGSrynwUIAAPEob.jpg
893027316946804736,2017-08-03 08:34:38,"b'RT @toisports: #INDvSL @cheteshwar1 joint second-fastest Indian to 4,000 Test runs \n\nREAD: https://t.co/UPEvEfBp3o https://t.co/oGF0kyu1eq'",http://pbs.twimg.com/media/DGSqvtOVoAAJfqF.jpg
893026151916077056,2017-08-03 08:30:00,b'Teacher strips girls in class for low English marks https://t.co/LhltSkMhOz via @TOICitiesNews https://t.co/x7m9Ts8OWW',http://pbs.twimg.com/media/DGSakM6UQAAu77G.jpg
893025442222841859,2017-08-03 08:27:11,"b""'Record breaking applications', thousands hired at @amazonIN job fair https://t.co/c1rPcdcmWv via @TOIBusiness https://t.co/9tPRxOfHqX""",http://pbs.twimg.com/media/DGSp4tQVoAA4rJo.jpg
893022376702623744,2017-08-03 08:15:00,b'US honchos throw weight behind new drive to court India https://t.co/NsLupbD9IA via @TOIBusiness https://t.co/GvpLfZPGPk',http://pbs.twimg.com/media/DGShcZ2U0AIYp1U.jpg
893021528668778496,2017-08-03 08:11:38,"b""IGIMS Patna removes the word 'virgin' from marital status declaration form after controversy, issues new form: ANI https://t.co/jLZ6coupkA""",http://pbs.twimg.com/media/DGSmU_dU0AAndOc.jpg
893018610725212161,2017-08-03 08:00:02,"b""8 'rival features' you may want to ditch @WhatsApp for https://t.co/Eqsr8tKANn via @gadgetsnow https://t.co/OIXJ9pQadw""",http://pbs.twimg.com/media/DGSdDzcUIAEcNtM.jpg
893014826716233728,2017-08-03 07:45:00,b'Nagaland floods have claimed 19: CM TR Zeliang https://t.co/M5cSwE5dhg via @TOICitiesNews https://t.co/14zweFuGCN',http://pbs.twimg.com/media/DGSZ9YjVwAIz1PS.jpg
893011051016589312,2017-08-03 07:30:00,b'Why the govt is disappointed with @RBI https://t.co/LdNUTAfKk7 via @TOIBusiness https://t.co/fQdDCXafRL',http://pbs.twimg.com/media/DGSZcybVoAAnPnh.jpg
893003506646478849,2017-08-03 07:00:01,b'.@arunjaitley indicates scope for clubbing 12% and 18% rates under GST https://t.co/FgmmVo7fB7 via @TOIBusiness https://t.co/O7cOcSwbXi',http://pbs.twimg.com/media/DGSO8FeUQAEOzxW.jpg
893000525511139328,2017-08-03 06:48:11,b'Errant doctors beware: Govt planning crackdown https://t.co/adi9CCWBK3 via @TOIBusiness https://t.co/WQhrPGs26O',http://pbs.twimg.com/media/DGSTN2AUAAIwDIJ.jpg
892998694366097408,2017-08-03 06:40:54,"b""Flood-hit NE states squabble over @narendramodi's relief package https://t.co/Q2rqKuWIKq via @TOICitiesNews https://t.co/hgtd9t4JgP""",http://pbs.twimg.com/media/DGSRcq4U0AAYgCX.jpg
892995952545583104,2017-08-03 06:30:00,b'16-year-old boy sodomised by 15 minors https://t.co/CMmnefFERJ via @TOIMumbai https://t.co/nWYOr9glXx',http://pbs.twimg.com/media/DGR_0F9UwAA5SnB.jpg
892995543663640576,2017-08-03 06:28:23,"b"".@VimalPredictor's Blog | No way better than Nitish-way https://t.co/HXPaJH7Tj4 via @TOIOpinion https://t.co/DvY986NhpN""",http://pbs.twimg.com/media/DGSOqYEVYAAlMSe.jpg
892992176908627968,2017-08-03 06:15:00,"b'After Bihar, next stop Tamil Nadu for BJP https://t.co/njgCGDgea7 via @TOIChennai https://t.co/yVMZ67fl7r'",http://pbs.twimg.com/media/DGSDyACUAAAYvRg.jpg
892990260208058368,2017-08-03 06:07:23,"b"".@firefox's new feature may change file sharing forever https://t.co/scvif9fn8h via @gadgetsnow https://t.co/XNFft6zwYa""",http://pbs.twimg.com/media/DGSJ5USVYAANpT-.jpg
892988402357940225,2017-08-03 06:00:00,"b'Let off by cops, man hangs self in police station loo https://t.co/4zmchdkNq8 via @TOIDelhi https://t.co/wNEyXvfSIm'",http://pbs.twimg.com/media/DGR_D64UMAAnslJ.jpg
892984627534614528,2017-08-03 05:45:00,b'326 technical education colleges in Uttar Pradesh have no students https://t.co/8ua4a4gsZr via @TOILucknow https://t.co/928vmkutRv',http://pbs.twimg.com/media/DGSCH6rUMAAUqzA.jpg
892981754897747968,2017-08-03 05:33:35,"b'On his last day in office as President, Pranab Mukherjee got this letter from PM Modi https://t.co/5XVTKNhV7L https://t.co/FA443ifnZ8'",http://pbs.twimg.com/media/DGSBChFUwAA9wuV.jpg
892980853827153920,2017-08-03 05:30:00,"b'After diesel and LPG, government to now end subsidy on kerosene https://t.co/bBi3CkHphV via @TOIBusiness https://t.co/rd6qWbPlsb'",http://pbs.twimg.com/media/DGR7NKAUAAASD8T.jpg
892978334761603072,2017-08-03 05:20:00,b'China again blocks move to name Masood Azhar a global terrorist at UN https://t.co/moJK75CnDe https://t.co/3xtKqnw2uB',http://pbs.twimg.com/media/DGR73K8V0AA-sEK.jpg
892977352455536641,2017-08-03 05:16:06,"b""D K Shivakumar: Congress' money and muscle man https://t.co/aVD7UTir0l via @TOIBengaluru https://t.co/7rQ2Ktp3ES""",http://pbs.twimg.com/media/DGR-KWEVoAAUP_N.jpg
892977078047457280,2017-08-03 05:15:00,b'IITs to mentor schoolgirls to up female count on campus https://t.co/Hc0829E4ll via @TOICitiesNews https://t.co/TzF2itS6qe',http://pbs.twimg.com/media/DGRykeCUIAA7lFm.jpg
892973302146244609,2017-08-03 05:00:00,b'Rare gift: Man donates liver to save old friend https://t.co/4eoWAHnKpx via @TOIDelhi https://t.co/VCnEdFwt8E',http://pbs.twimg.com/media/DGRpLVAVoAEpx1A.jpg
892970990782693377,2017-08-03 04:50:49,b'Fake appeals from PM @narendramodi circulate again on social media https://t.co/TWRsaOJYPx https://t.co/XPpiNTocvA',http://pbs.twimg.com/media/DGR4XbBUAAAocE3.jpg
892969526945558528,2017-08-03 04:45:00,"b'VP poll: @MVenkaiahNaidu writes to MPs, seeks support https://t.co/YVYqdumYEh https://t.co/9bGeyzRacO'",http://pbs.twimg.com/media/DGRxIO1V0AA5y8B.jpg
892965785047506944,2017-08-03 04:30:08,b'Take a look at all the top stories in 60 seconds https://t.co/BZnjunILiV',http://pbs.twimg.com/media/DGRzkhaUIAADazv.jpg
892965754001178625,2017-08-03 04:30:00,b'Delhi: Three out of 100 mothers 19 years or below https://t.co/CMO2VUs3WA via @TOIDelhi https://t.co/y6LLn35ITU',http://pbs.twimg.com/media/DGRrpoxUMAAEZ99.jpg
892963235804139520,2017-08-03 04:20:00,b'What @APanagariya said about PM @narendramodi https://t.co/ekVU9EHCTp via @TOIBusiness https://t.co/GeClqHj95t',http://pbs.twimg.com/media/DGRtJx8V0AA4qQ2.jpg
892960721104797697,2017-08-03 04:10:00,"b'SC directs companies to pay Rs 17,576 crore for illegal mining in Odisha https://t.co/WgRHlBqPAW https://t.co/NjrtFDpUQd'",http://pbs.twimg.com/media/DGRompIVoAABho8.jpg
892959352524382208,2017-08-03 04:04:34,b'World\xe2\x80\x99s 10 biggest smartphone companies https://t.co/ZwCWELofM5 via @gadgetsnow https://t.co/HSOBdH4Hkd',http://pbs.twimg.com/media/DGRtx1RUQAAihA7.jpg
892958205235544064,2017-08-03 04:00:01,"b"".@realDonaldTrump's merit-based immigration system may benefit Indians https://t.co/vNR0lNxvdI via @TOIWorld https://t.co/ca48UvotaR""",http://pbs.twimg.com/media/DGRnRKEUQAA1qah.jpg
892955686191198208,2017-08-03 03:50:00,"b'Cabinet clears plan to fail students in classes V, VIII https://t.co/O9BmDXlHp7 https://t.co/eUGdPqQBpF'",http://pbs.twimg.com/media/DGRlwrHVwAA_yzT.jpg
892953169755602944,2017-08-03 03:40:00,b'China claims India pulled out most troops from Doklam; govt denies https://t.co/XD1UZhIHwT https://t.co/yCsV4913PJ',http://pbs.twimg.com/media/DGRfOxRUQAE1RYZ.jpg
892951584644055040,2017-08-03 03:33:42,b'J&amp;K: Two Army personnel martyred in terror attack in Shopian https://t.co/4vaV1cchHX\n\n(Representative Image) https://t.co/RD2vOexwAc',http://pbs.twimg.com/media/DGRmr5nVYAAwxSW.jpg
892950653965713409,2017-08-03 03:30:00,b'.@arunjaitley: DK Shivakumar was destroying papers crucial for probe https://t.co/Yq0JtdXzni https://t.co/wvDLzkshtd',http://pbs.twimg.com/media/DGRckaAVwAAKYBt.jpg
892946882493730817,2017-08-03 03:15:01,"b"".@isro's launch capacity will get boost with new facility at Sriharikota by year-end https://t.co/zyKht9vdFb https://t.co/DBD5c39ONF""",http://pbs.twimg.com/media/DGRb27RUAAAXWTj.jpg
892943105334272002,2017-08-03 03:00:01,"b'Loans set to be cheaper as @RBI softens stand, cuts key policy rate https://t.co/rKgDgt3J9l via @TOIBusiness https://t.co/9XwAxp0mau'",http://pbs.twimg.com/media/DGRa_LnUIAA96ms.jpg
892939329072443392,2017-08-03 02:45:00,"b'Dujana to Armyman: Congrats, you caught me... But I can\xe2\x80\x99t surrender https://t.co/M6Y6J2GwEP https://t.co/4n7crEuaW3'",http://pbs.twimg.com/media/DGRaNGhUAAAfC6i.jpg
892926747313815552,2017-08-03 01:55:00,"b'Locate toll plazas away from city limits, congested areas: Parliamentary panel https://t.co/6lbunZ4qXz https://t.co/tTCYL2Ikc6'",http://pbs.twimg.com/media/DGQpYwSVYAE5BU2.jpg
892918441971130368,2017-08-03 01:22:00,"b'Cabinet clears plan to fail students in classes V, VIII https://t.co/O9BmDXDigF https://t.co/tsWqrqKb0h'",http://pbs.twimg.com/media/DGQoqtWUMAAgB_7.jpg
892897805697781760,2017-08-03 00:00:00,b'Ex-Noida CEO gets 4-year jail in 2 land cases https://t.co/uQv8ZEooqK https://t.co/4zeDjCJ8SU',http://pbs.twimg.com/media/DGQMTPRUAAAVRQG.jpg
892890259876265984,2017-08-02 23:30:01,b'Delhi: Three out of 100 mothers 19 years or below https://t.co/CMO2VUs3WA https://t.co/RuG0d7IQC8',http://pbs.twimg.com/media/DGQL50pUAAEppaZ.jpg
892880189931180032,2017-08-02 22:50:00,b'Rare gift: Man donates liver to save old friend https://t.co/4eoWAHnKpx https://t.co/AFAVA0TvNe',http://pbs.twimg.com/media/DGQLlQOU0AAtT_C.jpg
892869870538420224,2017-08-02 22:09:00,b'China claims India pulled out most troops from Doklam; govt denies https://t.co/XD1UZhIHwT https://t.co/q5PTjVIAmG',http://pbs.twimg.com/media/DGQKQZlVoAAJUx7.jpg
892860061348839424,2017-08-02 21:30:01,b'Jaitley: DK Shivakumar was destroying papers crucial for probe https://t.co/Yq0JtdXzni https://t.co/KRUqEx2vzo',http://pbs.twimg.com/media/DGQKGMhU0AEYJzu.jpg
892849584644304897,2017-08-02 20:48:23,"b'Loans set to be cheaper as RBI softens stand, cuts key policy rate https://t.co/rKgDgt3J9l https://t.co/gYoKkO0uG7'",http://pbs.twimg.com/media/DGQJ8MeUAAAxHXn.jpg
892822320351289345,2017-08-02 19:00:03,b'Death toll in West Bengal floods rises to 50 https://t.co/Z88jlNWNgv https://t.co/Ai4YSYmhnC',http://pbs.twimg.com/media/DGPiSKwUIAAQEEr.jpg
892818533364707335,2017-08-02 18:45:00,"b""Amid skyrocketing tomato prices, Congress opens 'State Bank of Tomato' https://t.co/gdWwQpbx8H via @TOILucknow https://t.co/XjC4Riu7H6""",http://pbs.twimg.com/media/DGPh2NDV0AA9ee3.jpg
892814766460284938,2017-08-02 18:30:02,b'H-1B visas: Cisco chairman John Chambers terms this as a mistake https://t.co/ztunVZ3cME via @gadgetsnow https://t.co/dQr0m9XxZ8',http://pbs.twimg.com/media/DGPVqcsVwAExSQg.jpg
892810986150805504,2017-08-02 18:15:01,b'US bosses back new drive to strengthen strategic ties with India https://t.co/JmxjFpfHpc https://t.co/fMJb7rsVMG',http://pbs.twimg.com/media/DGPfF0xUMAAvO03.jpg
892807226875760640,2017-08-02 18:00:05,b'Proxy voting for NRIs cleared by the Union Cabinet https://t.co/fNHE97tSrS via @TOIIndianAbroad https://t.co/9b3UqMI2W4',http://pbs.twimg.com/media/DGPd_C9UIAAP2wX.jpg
892803436747538433,2017-08-02 17:45:01,b'Muslim builder to hold Bhagwat Katha for Amarnath terror victims https://t.co/y8AjV9B1Gw via @TOICitiesNews https://t.co/oWtC6ig4F3',http://pbs.twimg.com/media/DGPa9P9VYAEtk0t.jpg
892799658900111360,2017-08-02 17:30:00,b'Railways dispatches special trains for flood-hit areas https://t.co/cAIf6eXFKv https://t.co/SD1Ps57kmk',http://pbs.twimg.com/media/DGPan8wUAAQf9yg.jpg
892797266762780672,2017-08-02 17:20:30,b'No reduction in troops at Doklam: India https://t.co/RBvdzXZIXI https://t.co/ka5tl8bYMy',http://pbs.twimg.com/media/DGPaX_xV0AA9Go4.jpg
892795886673305601,2017-08-02 17:15:01,"b'Build toilets, have coffee with collector in Barmer https://t.co/N6gEwQeSHB via @TOICitiesNews https://t.co/NNni1FllQq'",http://pbs.twimg.com/media/DGPSJX4UQAANTs2.jpg
892792117566812160,2017-08-02 17:00:02,"b""Congress petitions EC, says 'ensure safety of our Gujarat MLAs' https://t.co/asPYJDsQ73 https://t.co/3KhKyIGGGo""",http://pbs.twimg.com/media/DGPOLzfV0AAGIq7.jpg
892788336133365760,2017-08-02 16:45:01,"b'No bouquets please, says @myogiadityanath\xe2\x80\x99s government https://t.co/kfAph6eddn via @TOICitiesNews https://t.co/PzUAX5Ql2S'",http://pbs.twimg.com/media/DGPN8HjVoAAKIAP.jpg
892784563264528384,2017-08-02 16:30:01,"b""Sealing Pakistan border priority, 'smart fence' by March 2018: BSF chief https://t.co/QL4781V1e4 https://t.co/a5qK21f1tg""",http://pbs.twimg.com/media/DGPK9uYV0AEmTto.jpg
892780785891069952,2017-08-02 16:15:01,"b""Mob lynches elderly woman in Agra village, calls her 'witch' https://t.co/JsXwdxR8MP via @TOICitiesNews https://t.co/20IO5T6yFO""",http://pbs.twimg.com/media/DGPAumaUwAABXTN.jpg
892777469035429889,2017-08-02 16:01:50,b'Veteran actor @TheDilipKumar admitted to Lilavati hospital in Mumbai: ANI https://t.co/NutG5pGF4b',http://pbs.twimg.com/media/DGPIWAuV0AA-YxR.jpg
